{
  "$schema": "https://json-schema.org/draft/2020-12/schema",
  "$id": "workflow.schema.json",
  "title": "Workflow declaration",
  "description": "The shape of one workflow. A workflow is declared here as data, never inside a script. bin/workflow-spec.sh, bin/workflow-spawn.sh and bin/workflow-watch.sh read these files and hold no copy of any fact in them, so the orchestrator starts the correct agent by reading a spec instead of a human retyping parameters. Nothing in this schema names a project: the project lives in config/project.json alone.",
  "type": "object",
  "additionalProperties": false,
  "required": [
    "schema_version",
    "id",
    "version",
    "title",
    "why",
    "trigger",
    "agent",
    "gates",
    "exit",
    "record"
  ],
  "properties": {
    "schema_version": {
      "const": "1.0.0"
    },
    "id": {
      "type": "string",
      "pattern": "^[a-z][a-z0-9-]{2,31}$",
      "description": "Stable workflow id. The file must be named <id>.workflow.json; bin/workflow-spec.sh resolves it by that convention."
    },
    "version": {
      "type": "string",
      "pattern": "^[0-9]+\\.[0-9]+\\.[0-9]+$"
    },
    "title": {
      "type": "string",
      "minLength": 8,
      "maxLength": 120
    },
    "why": {
      "type": "string",
      "minLength": 40,
      "description": "Why this workflow exists, in terms of the failure it prevents. Required, not optional: a workflow that cannot answer this is machinery nobody asked for."
    },
    "trigger": {
      "type": "object",
      "additionalProperties": false,
      "required": [
        "on",
        "condition"
      ],
      "properties": {
        "on": {
          "enum": [
            "manual",
            "pre-commit",
            "gate-failure",
            "watcher-alert",
            "owner-action",
            "threshold"
          ]
        },
        "condition": {
          "type": "string",
          "minLength": 8
        },
        "watcher": {
          "type": "string",
          "pattern": "^bin/[a-z][a-z0-9-]*-watch\\.sh$",
          "description": "The watcher whose ALERT line raises this workflow, when on is watcher-alert or threshold."
        }
      }
    },
    "agent": {
      "type": "object",
      "additionalProperties": false,
      "description": "Everything needed to spawn the right agent. bin/workflow-spec.sh <id> prints exactly this object, and bin/workflow-spawn.sh consumes it. Per the repository's CLAUDE.md a seat is started through herdr and never through an in-process agent tool, and a seat that has finished its work exits.",
      "required": [
        "role",
        "effort",
        "context_threshold_percent",
        "allowed_tools",
        "denied_tools",
        "denied_commands",
        "allowed_paths"
      ],
      "properties": {
        "role": {
          "enum": [
            "architect",
            "builder",
            "verifier",
            "operator",
            "owner-channel"
          ]
        },
        "runtime": {
          "enum": [
            "claude",
            "codex",
            "kimi3"
          ]
        },
        "model": {
          "enum": [
            "haiku",
            "sonnet-5",
            "opus",
            "fable"
          ]
        },
        "models": {
          "type": "array",
          "minItems": 1,
          "description": "The model chain, in the order the owner ranks it. bin/workflow-spawn.sh starts link 0 and takes --link N; bin/seat-watch.sh hot swaps to the next link when a seat is rate limited, out of credit or stalled, and alerts once the chain is exhausted. BREADCRUMB: surface is a field of the link and never derived from herdr_kind. kimi-k3 runs through kimi-claude, which herdr detects as kind claude, yet it cannot mint a claude.ai artifact URL; deriving the surface from the kind handed it the artifact surface and a URL it would have to invent (owner law, O-08, 2026-09-22).",
          "items": {
            "type": "object",
            "additionalProperties": false,
            "required": [
              "id",
              "launcher",
              "herdr_kind",
              "surface"
            ],
            "properties": {
              "id": {
                "type": "string",
                "pattern": "^[a-z][a-z0-9-]{1,31}$",
                "description": "Stable name of the link, written into the seat-link file and the watcher log."
              },
              "launcher": {
                "type": "string",
                "pattern": "^[A-Za-z0-9._/-]+$",
                "description": "Executable on PATH that starts the seat. When it is not herdr_kind's own executable the spawner runs it in the pane and names the agent herdr detects, because herdr agent start only runs a kind's canonical binary."
              },
              "herdr_kind": {
                "enum": [
                  "claude",
                  "codex",
                  "kimi"
                ],
                "description": "What herdr detects in the pane. Decides the argument dialect the launcher is given, nothing else."
              },
              "model": {
                "type": "string",
                "pattern": "^[A-Za-z0-9._-]+$",
                "description": "Model id passed to the launcher. Optional: a launcher like kimi-claude pins its own model in its settings, and passing one would override the proxy's routing."
              },
              "surface": {
                "enum": [
                  "artifact",
                  "lavish"
                ],
                "description": "Exported as RAIL_SURFACE (dotfiles Rule 19). artifact only for a runtime that can mint a claude.ai URL."
              }
            }
          }
        },
        "effort": {
          "enum": [
            "low",
            "medium",
            "high"
          ]
        },
        "context_threshold_percent": {
          "type": "integer",
          "minimum": 10,
          "maximum": 90,
          "default": 30,
          "description": "Percent of the context window at or above which the seat runs the compaction ceremony before its next step, never mid-step. Required on every agent spec. A spec without it fails validation, because a threshold that lives in an agent's memory is not a threshold: it is a habit, and habits do not survive a handoff."
        },
        "allowed_tools": {
          "type": "array",
          "minItems": 1,
          "uniqueItems": true,
          "items": {
            "type": "string",
            "pattern": "^[A-Za-z][A-Za-z0-9_-]*\\*?$"
          },
          "description": "BREADCRUMB: the pattern admits a hyphen and one trailing star because a Claude in Chrome seat is granted the whole server, mcp__claude-in-chrome__*, and the old pattern refused both characters (inbox-sweep B1, WO-20261016-c8c8). Rejected alternative: listing every browser tool by name, which goes stale each time the extension adds one. Cost: a trailing star is a prefix grant, so denied_tools is where a browser seat's limits must be stated. Only allowed_tools is widened; denied_tools stays exact."
        },
        "denied_tools": {
          "type": "array",
          "uniqueItems": true,
          "items": {
            "type": "string",
            "pattern": "^[A-Za-z][A-Za-z0-9_]*$"
          },
          "description": "Task and Agent belong here for every seat: the repository's CLAUDE.md forbids in-process spawning, and a denial that is only written in prose is not a denial."
        },
        "denied_commands": {
          "type": "array",
          "uniqueItems": true,
          "items": {
            "type": "string",
            "minLength": 2
          },
          "description": "Exact command prefixes the seat must never run."
        },
        "allowed_paths": {
          "type": "array",
          "uniqueItems": true,
          "items": {
            "type": "string",
            "minLength": 1
          },
          "description": "Repo-relative write boundary, disjoint between seats that run at the same time. An empty array means the seat writes nothing."
        },
        "mcp": {
          "type": "string",
          "pattern": "^[a-z][a-z0-9-]{1,31}$",
          "description": "Names resources/mcp/<mcp>.json, the only MCP servers this seat starts. The spawner passes it as --strict-mcp-config --mcp-config. Absent means the user's full MCP set (about 650 MB more RSS per seat; resources-result AC3). BREADCRUMB: builders declare none or github because each default seat otherwise starts kubernetes, github, context7, notion and a jenkins container it never calls."
        }
      },
      "oneOf": [
        {
          "description": "Single form: one runtime and one model, no fallback. Every declaration written before O-08 uses it.",
          "required": [
            "runtime",
            "model"
          ],
          "not": {
            "required": [
              "models"
            ]
          }
        },
        {
          "description": "Chain form: an ordered list of links. Carrying runtime or model beside it is refused, because two statements of what the seat runs are two answers the spawner would have to choose between.",
          "required": [
            "models"
          ],
          "not": {
            "anyOf": [
              {
                "required": [
                  "runtime"
                ]
              },
              {
                "required": [
                  "model"
                ]
              }
            ]
          }
        }
      ]
    },
    "gates": {
      "type": "array",
      "minItems": 1,
      "description": "Every gate is a command with an expected result. A gate that cannot be run is not a gate. A gate that duplicates the project's own gate_command must call it rather than reimplement it.",
      "items": {
        "type": "object",
        "additionalProperties": false,
        "required": [
          "id",
          "command",
          "expect"
        ],
        "properties": {
          "id": {
            "type": "string",
            "pattern": "^[a-z][a-z0-9-]{1,31}$"
          },
          "command": {
            "type": "string",
            "minLength": 2
          },
          "expect": {
            "enum": [
              "exit-zero",
              "exit-nonzero",
              "line-match"
            ]
          },
          "match": {
            "type": "string"
          },
          "why": {
            "type": "string"
          },
          "owner_decision": {
            "type": "boolean",
            "default": false,
            "description": "True when the failure of this gate is a decision only the owner can take. The watcher prefixes such a line with ALERT and leaves every other line a lowercase key: prefix, so the owner hears one line only when the decision is theirs."
          }
        }
      }
    },
    "exit": {
      "type": "object",
      "additionalProperties": false,
      "required": [
        "condition",
        "verified_by"
      ],
      "properties": {
        "condition": {
          "type": "string",
          "minLength": 10
        },
        "verified_by": {
          "type": "string",
          "minLength": 2,
          "description": "The command a reader runs to see the exit condition for themselves."
        }
      }
    },
    "on_failure": {
      "type": "array",
      "minItems": 1,
      "items": {
        "type": "object",
        "additionalProperties": false,
        "required": [
          "case",
          "action",
          "outcome"
        ],
        "properties": {
          "case": {
            "type": "string",
            "minLength": 4
          },
          "action": {
            "type": "string",
            "minLength": 4
          },
          "outcome": {
            "type": "string",
            "minLength": 2
          },
          "runbook": {
            "type": "string",
            "pattern": "^runbooks/RB-[a-z-]+\\.md$"
          }
        }
      }
    },
    "record": {
      "type": "object",
      "additionalProperties": false,
      "required": [
        "emitted_to",
        "schema"
      ],
      "description": "The record this workflow emits, declared as a real JSON Schema so a validator can check an instance without knowing anything about the workflow.",
      "properties": {
        "emitted_to": {
          "type": "string",
          "pattern": "^state:[a-z][a-z0-9./-]*$",
          "description": "state:<path> relative to config/project.json's state_dir. Records never land in the repository."
        },
        "schema": {
          "type": "object",
          "required": [
            "type",
            "additionalProperties",
            "required",
            "properties"
          ],
          "properties": {
            "type": {
              "const": "object"
            },
            "additionalProperties": {
              "const": false,
              "description": "Enforced by this meta-schema rather than left to reviewer discipline. A record schema that tolerates unknown fields lets a drifting producer pass the gate silently."
            }
          }
        }
      }
    }
  }
}
