{
  "schema_version": "1.0.0",
  "id": "scaffold-build",
  "version": "1.0.0",
  "title": "Build one scoped project-scaffold ticket to a green suite",
  "why": "Prevents a builder seat from reporting project-scaffold work as done when the skill's own Podman suite was never run on the tree it committed. The gate is the project's gate_command, named once in config/project.json, so the suite has exactly one definition and a seat cannot substitute a lighter check.",
  "trigger": {
    "on": "manual",
    "condition": "The orchestrator hands a builder seat one scoped ticket - agent 2 provider surface, agent 3 lightweight cut, or rail wiring - with its test plan written in the brief."
  },
  "agent": {
    "role": "builder",
    "runtime": "claude",
    "model": "opus",
    "effort": "high",
    "context_threshold_percent": 30,
    "allowed_tools": [
      "Bash",
      "Read",
      "Edit",
      "Write",
      "Grep",
      "Glob"
    ],
    "denied_tools": [
      "Agent",
      "Task",
      "WebFetch",
      "WebSearch"
    ],
    "denied_commands": [
      "gh",
      "git push",
      "git merge",
      "git rebase",
      "git reset --hard",
      "git checkout main",
      "podman rmi",
      "sudo",
      "rm -rf /"
    ],
    "allowed_paths": [
      "claude/skills/project-scaffold/"
    ],
    "mcp": "none"
  },
  "gates": [
    {
      "id": "suite",
      "command": "${gate_command}",
      "expect": "exit-zero",
      "why": "The skill's full Podman suite, both images. A seat that runs a subset has proven the subset."
    },
    {
      "id": "suite-summary",
      "command": "${gate_command}",
      "expect": "line-match",
      "match": "all cases passed, both images",
      "why": "Exit zero alone can hide a runner that skipped an image; the summary line is only printed when both ran."
    },
    {
      "id": "no-version-touch",
      "command": "! git diff --name-only main... | grep -qx 'claude/skills/registry.json' && ! git diff main... -- 'claude/skills/*/SKILL.md' | grep -qE '^[+-]version:'",
      "expect": "exit-zero",
      "why": "Rule 16: a branch never allocates a version. The versioning ceremony is suspended for this work, so a version line in the diff is a mistake, not a bump.",
      "owner_decision": false
    }
  ],
  "exit": {
    "condition": "The ticket's test plan passes, the full suite is green in Podman on both images, the work is committed on the seat's branch with a message that names what the suite proved, and the seat's last act is bin/seat-record.sh passed --commit <sha> --note '<first line>'.",
    "verified_by": "${gate_command}"
  },
  "on_failure": [
    {
      "case": "the suite is red",
      "action": "Fix the cause and rerun the suite. Never report the ticket done on a red suite.",
      "outcome": "failed"
    },
    {
      "case": "three consecutive red runs on the same case",
      "action": "Stop, write the failing case and its output to the handoff, and report blocked. Do not weaken the case to make it pass.",
      "outcome": "blocked"
    },
    {
      "case": "podman is unavailable",
      "action": "Report the environment fault. Never fall back to running the suite on the host (Rule 14).",
      "outcome": "blocked"
    },
    {
      "case": "the ticket needs a file outside allowed_paths",
      "action": "Stop and ask the orchestrator. The write boundary is what keeps two seats off the same file.",
      "outcome": "blocked"
    }
  ],
  "record": {
    "emitted_to": "state:records/scaffold-build.jsonl",
    "schema": {
      "type": "object",
      "additionalProperties": false,
      "required": [
        "schema_version",
        "workflow",
        "workflow_version",
        "at",
        "role",
        "outcome",
        "ticket"
      ],
      "properties": {
        "schema_version": {
          "const": "1.0.0"
        },
        "workflow_version": {
          "type": "string",
          "pattern": "^[0-9]+\\.[0-9]+\\.[0-9]+$"
        },
        "at": {
          "type": "string",
          "pattern": "^[0-9]{4}-[0-9]{2}-[0-9]{2}T[0-9]{2}:[0-9]{2}:[0-9]{2}Z$"
        },
        "role": {
          "enum": [
            "architect",
            "builder",
            "verifier",
            "operator",
            "owner-channel"
          ]
        },
        "note": {
          "type": "string",
          "maxLength": 240
        },
        "evidence": {
          "type": "array",
          "items": {
            "type": "string",
            "minLength": 1
          }
        },
        "workflow": {
          "const": "scaffold-build"
        },
        "ticket": {
          "type": "string",
          "minLength": 2
        },
        "outcome": {
          "enum": [
            "passed",
            "failed",
            "blocked"
          ]
        },
        "commit": {
          "type": "string",
          "pattern": "^[0-9a-f]{7,40}$"
        },
        "suite": {
          "type": "string",
          "maxLength": 120
        }
      }
    }
  }
}
