{
  "schema_version": "1.0.0",
  "id": "compaction",
  "version": "1.0.0",
  "title": "Compact a seat at its threshold without losing the plan",
  "why": "Prevents a seat quietly running out of context mid-plan and failing in a way that reads like a tooling fault. The threshold lives in this spec rather than in a seat's memory, so it survives a handoff, a restart and a change of model. The checkpoint format is owned by the context-compaction skill; this declaration supplies the threshold, the trigger and the ceremony, so there is one checkpoint format and not two.",
  "trigger": {
    "on": "threshold",
    "condition": "The seat's context is at or above context_threshold_percent, or the seat touched its compact-request after writing a checkpoint. Never mid-step: the seat finishes its step, then checkpoints, then requests.",
    "watcher": "bin/compact-watch.sh"
  },
  "agent": {
    "role": "operator",
    "runtime": "claude",
    "model": "opus",
    "effort": "low",
    "context_threshold_percent": 30,
    "allowed_tools": [
      "Bash",
      "Read"
    ],
    "denied_tools": [
      "Agent",
      "Task",
      "Edit",
      "Write",
      "WebFetch",
      "WebSearch"
    ],
    "denied_commands": [
      "gh",
      "git commit",
      "git push",
      "sudo"
    ],
    "allowed_paths": []
  },
  "gates": [
    {
      "id": "skill-present",
      "command": "test -r ${skills_dir}/context-compaction/scripts/checkpoint.sh",
      "expect": "exit-zero",
      "why": "The checkpoint format has one implementation, the installed context-compaction skill. Readable, not executable: it ships mode 0644 and is invoked with bash, so test -x reports a correct install as missing (found by running this gate in the kimi proxy, not by reading)."
    },
    {
      "id": "herdr-up",
      "command": "command -v herdr >/dev/null && herdr workspace list >/dev/null",
      "expect": "exit-zero",
      "owner_decision": true,
      "why": "Every compaction is a send into a herdr pane and every watcher lives in one. With herdr down nothing compacts, and that is the owner's to fix."
    }
  ],
  "exit": {
    "condition": "A new compact_boundary is in the seat's transcript, the ceremony report's verdict is OK, and the seat's next act was to read its top checkpoint.",
    "verified_by": "cat ${state_dir}/seats/<pane>/ceremony-compact.md"
  },
  "on_failure": [
    {
      "case": "the seat is mid-step",
      "action": "Hold. The watcher nudges at the threshold and waits for the seat's request; it never cuts a step.",
      "outcome": "held",
      "runbook": "runbooks/RB-compaction.md"
    },
    {
      "case": "the seat checkpoint does not verify",
      "action": "compact-now.sh refuses with exit 3 and writes nothing. The seat fixes its checkpoint and requests again.",
      "outcome": "refused",
      "runbook": "runbooks/RB-compaction.md"
    },
    {
      "case": "no compact_boundary within the wait",
      "action": "Report DEFECT and never resend. A resend lands in the fresh session and is the double-compaction defect.",
      "outcome": "failed",
      "runbook": "runbooks/RB-compaction.md"
    },
    {
      "case": "context reaches the ceiling with no request",
      "action": "ALERT, then compact without a checkpoint. Losing some state beats a seat that dies mid-step.",
      "outcome": "forced",
      "runbook": "runbooks/RB-compaction.md"
    }
  ],
  "record": {
    "emitted_to": "state:seats/compact.jsonl",
    "schema": {
      "type": "object",
      "additionalProperties": false,
      "required": [
        "schema_version",
        "workflow",
        "workflow_version",
        "at",
        "role",
        "outcome",
        "pane"
      ],
      "properties": {
        "schema_version": {
          "const": "1.0.0"
        },
        "workflow": {
          "const": "compaction"
        },
        "workflow_version": {
          "type": "string",
          "pattern": "^[0-9]+\\.[0-9]+\\.[0-9]+$"
        },
        "at": {
          "type": "string",
          "pattern": "^[0-9]{4}-[0-9]{2}-[0-9]{2}T[0-9]{2}:[0-9]{2}:[0-9]{2}Z$"
        },
        "role": {
          "enum": [
            "architect",
            "builder",
            "verifier",
            "operator",
            "owner-channel"
          ]
        },
        "pane": {
          "type": "string",
          "minLength": 3
        },
        "outcome": {
          "enum": [
            "compacted",
            "held",
            "refused",
            "failed",
            "forced"
          ]
        },
        "context_percent": {
          "type": "integer",
          "minimum": 0,
          "maximum": 100
        },
        "verdict": {
          "enum": [
            "OK",
            "DEFECT"
          ]
        },
        "note": {
          "type": "string",
          "maxLength": 240
        }
      }
    }
  }
}
