{
  "schema_version": "1.0.0",
  "id": "seat-smoke",
  "version": "1.0.0",
  "title": "Prove a seat's lifecycle live: spawn, record, done line, retire",
  "why": "Prevents the seat lifecycle from being proven only against a stub herdr. The O-09 suite passed on fixture records while no live seat had ever written one; this declaration starts a cheap throwaway seat through the real spawner so the done line reaching the principal and the seat exiting can be seen for real.",
  "trigger": {
    "on": "manual",
    "condition": "After a change to bin/workflow-spawn.sh, bin/seat-watch.sh or bin/seat-record.sh, run: bin/workflow-spawn.sh seat-smoke smoke --ticket SMOKE-1 --brief-file <one-line brief>."
  },
  "agent": {
    "role": "operator",
    "runtime": "claude",
    "model": "haiku",
    "effort": "low",
    "context_threshold_percent": 30,
    "allowed_tools": [
      "Bash",
      "Read"
    ],
    "denied_tools": [
      "Agent",
      "Task",
      "Edit",
      "Write",
      "WebFetch",
      "WebSearch"
    ],
    "denied_commands": [
      "gh",
      "git",
      "sudo",
      "rm"
    ],
    "allowed_paths": []
  },
  "gates": [
    {
      "id": "noop",
      "command": "true",
      "expect": "exit-zero",
      "why": "The smoke seat proves the lifecycle, not a tree; its gate passes at once so the gate watcher is seen to arm and end."
    }
  ],
  "exit": {
    "condition": "The seat's last act is bin/seat-record.sh passed --note '<first line>'; the principal pane receives the done line and the seat watcher retires the seat.",
    "verified_by": "tail -n 5 ~/.local/state/dotfiles/execution/seats/<pane>/seat-watch.log"
  },
  "record": {
    "emitted_to": "state:records/seat-smoke.jsonl",
    "schema": {
      "type": "object",
      "additionalProperties": false,
      "required": [
        "schema_version",
        "workflow",
        "workflow_version",
        "at",
        "role",
        "outcome",
        "ticket"
      ],
      "properties": {
        "schema_version": {
          "const": "1.0.0"
        },
        "workflow": {
          "const": "seat-smoke"
        },
        "workflow_version": {
          "type": "string",
          "pattern": "^[0-9]+\\.[0-9]+\\.[0-9]+$"
        },
        "at": {
          "type": "string",
          "pattern": "^[0-9]{4}-[0-9]{2}-[0-9]{2}T[0-9]{2}:[0-9]{2}:[0-9]{2}Z$"
        },
        "role": {
          "const": "operator"
        },
        "outcome": {
          "enum": [
            "passed",
            "failed"
          ]
        },
        "ticket": {
          "type": "string",
          "minLength": 2
        },
        "note": {
          "type": "string",
          "maxLength": 240
        }
      }
    }
  }
}
