{
  "schema_version": "1.0.0",
  "id": "orchestration-build",
  "version": "1.0.0",
  "title": "Build one scoped orchestration ticket to a green make test",
  "why": "Prevents a builder seat from reporting workflow machinery as done when make test in claude/workflow was never run on the tree it committed. make test is the one definition: schema, shellcheck, herdr-first lint and the watcher suites, all in Podman.",
  "trigger": {
    "on": "manual",
    "condition": "The orchestrator hands a builder seat one scoped orchestration ticket - architect model chain, failover watcher, test-plan block - with its test plan written in the brief."
  },
  "agent": {
    "role": "builder",
    "runtime": "claude",
    "model": "opus",
    "effort": "high",
    "context_threshold_percent": 30,
    "allowed_tools": [
      "Bash",
      "Read",
      "Edit",
      "Write",
      "Grep",
      "Glob"
    ],
    "denied_tools": [
      "Agent",
      "Task",
      "WebFetch",
      "WebSearch"
    ],
    "denied_commands": [
      "gh",
      "git push",
      "git merge",
      "git rebase",
      "git reset --hard",
      "git checkout main",
      "podman rmi",
      "sudo",
      "rm -rf /"
    ],
    "allowed_paths": [
      "claude/workflow/",
      "claude/skills/work-order/",
      ".github/workflows/"
    ]
  },
  "gates": [
    {
      "id": "make-test",
      "command": "make -C claude/workflow test",
      "expect": "exit-zero",
      "why": "Schema, shellcheck, herdr-first lint and every watcher suite, in the pinned Podman image. A seat that runs a subset has proven the subset."
    }
  ],
  "exit": {
    "condition": "The ticket test plan passes, make test is green in Podman, the work is committed on the seat branch with a message that names what the tests proved, and the seat's last act is bin/seat-record.sh passed --commit <sha> --note '<first line>'.",
    "verified_by": "make -C claude/workflow test"
  },
  "on_failure": [
    {
      "case": "make test is red",
      "action": "Fix the cause and rerun the suite. Never report the ticket done on a red suite.",
      "outcome": "failed"
    },
    {
      "case": "three consecutive red runs on the same case",
      "action": "Stop, write the failing case and its output to the handoff, and report blocked. Do not weaken the case to make it pass.",
      "outcome": "blocked"
    },
    {
      "case": "podman is unavailable",
      "action": "Report the environment fault. Never fall back to running the suite on the host (Rule 14).",
      "outcome": "blocked"
    },
    {
      "case": "the ticket needs a file outside allowed_paths",
      "action": "Stop and ask the orchestrator. The write boundary is what keeps two seats off the same file.",
      "outcome": "blocked"
    }
  ],
  "record": {
    "emitted_to": "state:records/orchestration-build.jsonl",
    "schema": {
      "type": "object",
      "additionalProperties": false,
      "required": [
        "schema_version",
        "workflow",
        "workflow_version",
        "at",
        "role",
        "outcome",
        "ticket"
      ],
      "properties": {
        "schema_version": {
          "const": "1.0.0"
        },
        "workflow_version": {
          "type": "string",
          "pattern": "^[0-9]+\\.[0-9]+\\.[0-9]+$"
        },
        "at": {
          "type": "string",
          "pattern": "^[0-9]{4}-[0-9]{2}-[0-9]{2}T[0-9]{2}:[0-9]{2}:[0-9]{2}Z$"
        },
        "role": {
          "enum": [
            "architect",
            "builder",
            "verifier",
            "operator",
            "owner-channel"
          ]
        },
        "note": {
          "type": "string",
          "maxLength": 240
        },
        "evidence": {
          "type": "array",
          "items": {
            "type": "string",
            "minLength": 1
          }
        },
        "workflow": {
          "const": "orchestration-build"
        },
        "ticket": {
          "type": "string",
          "minLength": 2
        },
        "outcome": {
          "enum": [
            "passed",
            "failed",
            "blocked"
          ]
        },
        "commit": {
          "type": "string",
          "pattern": "^[0-9a-f]{7,40}$"
        },
        "suite": {
          "type": "string",
          "maxLength": 120
        }
      }
    }
  }
}
