{
  "schema_version": "1.0.0",
  "id": "scaffold-review",
  "version": "1.0.0",
  "title": "Fresh-eyes review of the project-scaffold branch diff",
  "why": "Prevents the author of a change from being its only reviewer. A seat that wrote the code reads it the way it meant it, not the way it is; a separate seat with no write access reads the diff cold and can only report, so a review cannot quietly turn into a rewrite.",
  "trigger": {
    "on": "manual",
    "condition": "The integration gate is green on the final tree of the scaffold branch and the orchestrator is about to open the pull request."
  },
  "agent": {
    "role": "verifier",
    "runtime": "claude",
    "model": "opus",
    "effort": "high",
    "context_threshold_percent": 30,
    "allowed_tools": [
      "Bash",
      "Read",
      "Grep",
      "Glob"
    ],
    "denied_tools": [
      "Agent",
      "Task",
      "Edit",
      "Write",
      "NotebookEdit",
      "WebFetch",
      "WebSearch"
    ],
    "denied_commands": [
      "gh",
      "git commit",
      "git push",
      "git merge",
      "git rebase",
      "git reset",
      "git checkout",
      "podman rmi",
      "sudo"
    ],
    "allowed_paths": []
  },
  "gates": [
    {
      "id": "suite",
      "command": "${gate_command}",
      "expect": "exit-zero",
      "why": "The reviewer confirms the suite for itself rather than trusting the builder's report of it."
    },
    {
      "id": "pii",
      "command": "! git diff main... | grep -E '^\\+' | grep -Ei '(/home/[a-z]+|@proton\\.me|ghcr\\.io/[a-z0-9-]+/|[0-9]{1,3}\\.[0-9]{1,3}\\.[0-9]{1,3}\\.[0-9]{1,3})'",
      "expect": "exit-zero",
      "why": "Public repository: an added line carrying a home path, an email, a registry owner or an IP address is a leak, whoever wrote it.",
      "owner_decision": true
    }
  ],
  "exit": {
    "condition": "A findings report is written to the state directory naming each finding with file, line, severity and the failure it would cause, or stating plainly that there are none.",
    "verified_by": "cat ${state_dir}/records/scaffold-review.jsonl | tail -n 1"
  },
  "on_failure": [
    {
      "case": "the PII gate matches",
      "action": "Report the file and line to the owner as ALERT. Do not fix it; the reviewer has no write access by design.",
      "outcome": "blocked"
    },
    {
      "case": "a finding needs a code change",
      "action": "Report it with file, line and the failure it causes. The orchestrator routes it to a builder seat.",
      "outcome": "findings"
    }
  ],
  "record": {
    "emitted_to": "state:records/scaffold-review.jsonl",
    "schema": {
      "type": "object",
      "additionalProperties": false,
      "required": [
        "schema_version",
        "workflow",
        "workflow_version",
        "at",
        "role",
        "outcome",
        "findings"
      ],
      "properties": {
        "schema_version": {
          "const": "1.0.0"
        },
        "workflow_version": {
          "type": "string",
          "pattern": "^[0-9]+\\.[0-9]+\\.[0-9]+$"
        },
        "at": {
          "type": "string",
          "pattern": "^[0-9]{4}-[0-9]{2}-[0-9]{2}T[0-9]{2}:[0-9]{2}:[0-9]{2}Z$"
        },
        "role": {
          "enum": [
            "architect",
            "builder",
            "verifier",
            "operator",
            "owner-channel"
          ]
        },
        "note": {
          "type": "string",
          "maxLength": 240
        },
        "evidence": {
          "type": "array",
          "items": {
            "type": "string",
            "minLength": 1
          }
        },
        "workflow": {
          "const": "scaffold-review"
        },
        "outcome": {
          "enum": [
            "clean",
            "findings",
            "blocked"
          ]
        },
        "findings": {
          "type": "integer",
          "minimum": 0
        },
        "report": {
          "type": "string",
          "minLength": 1
        }
      }
    }
  }
}
